{
  "schema_version": 1,
  "generator": "tasklist-rebuild@1.0.0",
  "updated": "2026-05-02T04:18:17.062Z",
  "next_task_id": "TASK-036",
  "previous_task": {
    "id": "TASK-028",
    "title": "Resolver: add per-shard status safety net + drift warning",
    "status": "done",
    "effort": "S",
    "completed": "2026-05-02T04:17:55Z"
  },
  "current_task": {
    "id": "TASK-010",
    "title": "Implement collision prompt (resume / restart / abandon)",
    "status": "in-progress",
    "effort": "S",
    "started": "2026-05-01T22:36:22.597Z",
    "assignee": null,
    "depends_on": [
      "TASK-009"
    ],
    "acceptance_criteria_count": 4
  },
  "next_task": {
    "id": "TASK-001",
    "title": "Bootstrap test infrastructure (vitest)",
    "status": "backlog",
    "effort": "S",
    "priority": "high",
    "depends_on": []
  },
  "open_tasks": [
    {
      "id": "TASK-001",
      "title": "Bootstrap test infrastructure (vitest)",
      "status": "backlog",
      "effort": "S",
      "priority": "high",
      "tags": [
        "foundation",
        "sprint-shard-a",
        "testing"
      ]
    },
    {
      "id": "TASK-002",
      "title": "Create test fixtures for `.tasks/` and `.issues/`",
      "status": "backlog",
      "effort": "S",
      "priority": "high",
      "tags": [
        "foundation",
        "sprint-shard-a",
        "testing"
      ]
    },
    {
      "id": "TASK-003",
      "title": "Implement `shard-library.mjs` core: `loadLibraries`, `locateShard`, `updateShard`",
      "status": "backlog",
      "effort": "M",
      "priority": "high",
      "tags": [
        "lib-core",
        "sprint-shard-a"
      ]
    },
    {
      "id": "TASK-004",
      "title": "Implement `shard-library.mjs` rebuild + status inference",
      "status": "backlog",
      "effort": "M",
      "priority": "high",
      "tags": [
        "lib-core",
        "sprint-shard-a"
      ]
    },
    {
      "id": "TASK-005",
      "title": "Implement `shard-library.mjs` link scanner",
      "status": "backlog",
      "effort": "S",
      "priority": "high",
      "tags": [
        "lib-core",
        "sprint-shard-a"
      ]
    },
    {
      "id": "TASK-006",
      "title": "Unit tests for `shard-library.mjs` (all 6 APIs)",
      "status": "backlog",
      "effort": "M",
      "priority": "high",
      "tags": [
        "testing",
        "sprint-shard-a"
      ]
    },
    {
      "id": "TASK-007",
      "title": "Update `load-config.mjs` to expose `shardLibraries`",
      "status": "backlog",
      "effort": "S",
      "priority": "high",
      "tags": [
        "integration",
        "sprint-shard-a"
      ]
    },
    {
      "id": "TASK-008",
      "title": "Migrate `resolve-tasks.mjs` to use `loadLibraries()`",
      "status": "backlog",
      "effort": "S",
      "priority": "high",
      "tags": [
        "integration",
        "sprint-shard-a"
      ]
    },
    {
      "id": "TASK-009",
      "title": "Add status flip to `branch-setup.mjs`",
      "status": "backlog",
      "effort": "M",
      "priority": "high",
      "tags": [
        "integration",
        "sprint-shard-b"
      ]
    },
    {
      "id": "TASK-010",
      "title": "Implement collision prompt (resume / restart / abandon)",
      "status": "in-progress",
      "effort": "S",
      "priority": "high",
      "tags": [
        "integration",
        "sprint-shard-b"
      ]
    },
    {
      "id": "TASK-011",
      "title": "Integration test for `branch-setup.mjs`",
      "status": "backlog",
      "effort": "S",
      "priority": "high",
      "tags": [
        "testing",
        "sprint-shard-b"
      ]
    },
    {
      "id": "TASK-012",
      "title": "Add primary-shard close to `merge-task.mjs`",
      "status": "backlog",
      "effort": "M",
      "priority": "high",
      "tags": [
        "integration",
        "sprint-shard-c"
      ]
    },
    {
      "id": "TASK-013",
      "title": "Add cross-library link closing to `merge-task.mjs`",
      "status": "backlog",
      "effort": "M",
      "priority": "high",
      "tags": [
        "integration",
        "sprint-shard-c"
      ]
    },
    {
      "id": "TASK-014",
      "title": "Commit `.tasks/` and `.issues/` deltas onto sprint branch",
      "status": "backlog",
      "effort": "S",
      "priority": "high",
      "tags": [
        "integration",
        "sprint-shard-c"
      ]
    },
    {
      "id": "TASK-015",
      "title": "Integration test for `merge-task.mjs` with linkage",
      "status": "backlog",
      "effort": "M",
      "priority": "high",
      "tags": [
        "testing",
        "sprint-shard-c"
      ]
    },
    {
      "id": "TASK-016",
      "title": "Regression test: re-run sprint completes 0 tasks",
      "status": "backlog",
      "effort": "S",
      "priority": "high",
      "tags": [
        "testing",
        "sprint-shard-c"
      ]
    },
    {
      "id": "TASK-017",
      "title": "Rewrite `skill/SKILL.md` Configuration section",
      "status": "backlog",
      "effort": "M",
      "priority": "medium",
      "tags": [
        "docs",
        "sprint-shard-d"
      ]
    },
    {
      "id": "TASK-018",
      "title": "Update `README.md`",
      "status": "backlog",
      "effort": "S",
      "priority": "medium",
      "tags": [
        "docs",
        "sprint-shard-d"
      ]
    },
    {
      "id": "TASK-019",
      "title": "Audit `commands/*.md` for behavior changes",
      "status": "backlog",
      "effort": "S",
      "priority": "medium",
      "tags": [
        "docs",
        "sprint-shard-d"
      ]
    },
    {
      "id": "TASK-020",
      "title": "Live acceptance test against `issues-plugin` sprint-4",
      "status": "backlog",
      "effort": "S",
      "priority": "high",
      "tags": [
        "acceptance",
        "sprint-shard-d"
      ]
    },
    {
      "id": "TASK-021",
      "title": "Tag release v1.x.0",
      "status": "backlog",
      "effort": "XS",
      "priority": "medium",
      "tags": [
        "release",
        "sprint-shard-d"
      ]
    },
    {
      "id": "TASK-022",
      "title": "Post-launch monitoring task (placeholder)",
      "status": "backlog",
      "effort": "XS",
      "priority": "low",
      "tags": [
        "post-launch",
        "sprint-shard-d"
      ]
    },
    {
      "id": "TASK-023",
      "title": "Document PLAN §3 Case-B .md synthesizer deviation",
      "status": "backlog",
      "effort": "XS",
      "priority": "low",
      "tags": [
        "docs",
        "tech-debt",
        "sprint-1-followup"
      ]
    },
    {
      "id": "TASK-024",
      "title": "Extract shared loadOrchestratorConfig helper",
      "status": "backlog",
      "effort": "S",
      "priority": "low",
      "tags": [
        "refactor",
        "tech-debt",
        "sprint-1-followup"
      ]
    },
    {
      "id": "TASK-025",
      "title": "Document shard library config trust boundary",
      "status": "backlog",
      "effort": "XS",
      "priority": "low",
      "tags": [
        "docs",
        "security",
        "sprint-1-followup"
      ]
    },
    {
      "id": "TASK-026",
      "title": "Sprint-2 hardening: error envelope + backdoor namespace",
      "status": "backlog",
      "effort": "S",
      "priority": "medium",
      "tags": [
        "hardening",
        "sprint-shard-b-followup"
      ]
    },
    {
      "id": "TASK-027",
      "title": "Sprint-3 consolidation: unify lib/, extract is-main, add reasons registry",
      "status": "backlog",
      "effort": "M",
      "priority": "high",
      "tags": [
        "sprint-shard-c",
        "refactor",
        "architectural-debt"
      ]
    },
    {
      "id": "TASK-030",
      "title": "Reasons registry: introduce family aggregates",
      "status": "backlog",
      "effort": "XS",
      "priority": "medium",
      "tags": [
        "refactor",
        "tech-debt",
        "sprint-3-followup"
      ]
    },
    {
      "id": "TASK-031",
      "title": "Document merge-task JSON envelope schema",
      "status": "backlog",
      "effort": "S",
      "priority": "medium",
      "tags": [
        "docs",
        "sprint-3-followup"
      ]
    },
    {
      "id": "TASK-032",
      "title": "Document tests/integration/ convention",
      "status": "backlog",
      "effort": "XS",
      "priority": "low",
      "tags": [
        "docs",
        "sprint-3-followup"
      ]
    },
    {
      "id": "TASK-034",
      "title": "Spike: programmatic lib/tasklist-rebuild.mjs API",
      "status": "backlog",
      "effort": "M",
      "priority": "medium",
      "tags": [
        "spike",
        "design",
        "sprint-3-followup"
      ]
    },
    {
      "id": "TASK-035",
      "title": "tasklist-doctor: INDEX integrity check command",
      "status": "backlog",
      "effort": "M",
      "priority": "low",
      "tags": [
        "feature",
        "resilience",
        "sprint-3-followup"
      ]
    }
  ],
  "blocked_tasks": [],
  "counts": {
    "total": 35,
    "backlog": 31,
    "ready": 0,
    "in_progress": 1,
    "blocked": 0,
    "review": 0,
    "done": 3,
    "cancelled": 0,
    "open": 32,
    "closed": 3,
    "archived": 0
  },
  "effort_summary": {
    "open_hours": 69.5,
    "closed_estimate_hours": 4.5,
    "closed_actual_hours": 4.5,
    "estimate_accuracy": 1
  },
  "project_root": "C:\\Coding\\ai_dev\\orchestrator"
}
